{
  "schemaVersion": "1.0",
  "run": {
    "runId": "8f6fdee6-a162-47b1-a6d9-39f340c2a325",
    "pipelineName": "pl_bronze_ingestion",
    "status": "Completed",
    "completedAtUtc": "2026-08-24T18:26:00.671896+00:00"
  },
  "aoi": {
    "latitude": 49.2193,
    "longitude": -122.5984,
    "bronzeRadiusKm": 20.0,
    "analysisRadiusKm": 3.0,
    "analysisCrs": "EPSG:32610",
    "resolutionM": 10.0
  },
  "method": {
    "riskFactor": "RF-1",
    "formula": "risk_score = s_rating * c_rating",
    "bandDefinitions": [
      {
        "band": "Low",
        "minimumScore": 1,
        "maximumScore": 4
      },
      {
        "band": "Moderate",
        "minimumScore": 5,
        "maximumScore": 9
      },
      {
        "band": "High",
        "minimumScore": 10,
        "maximumScore": 19
      },
      {
        "band": "Extreme",
        "minimumScore": 20,
        "maximumScore": 25
      }
    ]
  },
  "sourceCoverage": [
    {
      "sourceName": "ALOS PALSAR mosaic STAC items",
      "tableName": "bronze_alos_palsar_mosaic",
      "status": "available",
      "recordCount": 7,
      "evidenceId": "E3"
    },
    {
      "sourceName": "BC bedrock geology",
      "tableName": "bronze_bc_bedrock_geology",
      "status": "available",
      "recordCount": 18,
      "evidenceId": "E4"
    },
    {
      "sourceName": "BC geological fault lines",
      "tableName": "bronze_bc_geological_faults",
      "status": "available",
      "recordCount": 8,
      "evidenceId": "E5"
    },
    {
      "sourceName": "BC quaternary / surficial geology",
      "tableName": "bronze_bc_quaternary_geology",
      "status": "available",
      "recordCount": 1,
      "evidenceId": "E6"
    },
    {
      "sourceName": "BC SIFT - soil survey project boundaries",
      "tableName": "bronze_bc_soil_project_boundaries",
      "status": "available",
      "recordCount": 7,
      "evidenceId": "E7"
    },
    {
      "sourceName": "BC Soil Information Finder Tool (SIFT) - soil survey polygons",
      "tableName": "bronze_bc_soil_survey_polygons",
      "status": "available",
      "recordCount": 4235,
      "evidenceId": "E8"
    },
    {
      "sourceName": "Copernicus DEM GLO-30 STAC items",
      "tableName": "bronze_cop_dem_glo_30",
      "status": "available",
      "recordCount": 1,
      "evidenceId": "E9"
    },
    {
      "sourceName": "ESA WorldCover STAC items",
      "tableName": "bronze_esa_worldcover",
      "status": "available",
      "recordCount": 2,
      "evidenceId": "E10"
    },
    {
      "sourceName": "Harmonized global biomass STAC items",
      "tableName": "bronze_hgb",
      "status": "available",
      "recordCount": 1,
      "evidenceId": "E11"
    },
    {
      "sourceName": "Esri 10 m land use / land cover STAC items",
      "tableName": "bronze_io_lulc_9_class",
      "status": "available",
      "recordCount": 6,
      "evidenceId": "E12"
    },
    {
      "sourceName": "Single-collection parameterised demo table",
      "tableName": "bronze_satellite_stac_items",
      "status": "available",
      "recordCount": 680,
      "evidenceId": "E13"
    },
    {
      "sourceName": "Sentinel-1 GRD radar STAC items",
      "tableName": "bronze_sentinel_1_grd",
      "status": "unavailable",
      "recordCount": null,
      "note": "bronze table could not be read: [PATH_NOT_FOUND] Path does not exist: abfss://dcfeb6a8-515b-43d5-be76-f7c56788abd6@onelake.dfs.fabric.microsoft.com/73586c5b-0059-4cd8-862e-4b1d72a473c4/Tables/bronze_sentinel_1_grd.",
      "evidenceId": "E14"
    },
    {
      "sourceName": "Sentinel-1 RTC radar STAC items",
      "tableName": "bronze_sentinel_1_rtc",
      "status": "available",
      "recordCount": 20,
      "evidenceId": "E15"
    },
    {
      "sourceName": "Sentinel-2 L2A optical STAC items",
      "tableName": "bronze_sentinel_2_l2a",
      "status": "available",
      "recordCount": 20,
      "evidenceId": "E16"
    }
  ],
  "riskSummary": {
    "totalPixels": 360000,
    "totalAreaKm2": 36.0,
    "bands": [
      {
        "band": "Low",
        "pixelCount": 146644,
        "areaKm2": 14.6644,
        "pct": 40.73444444444444,
        "evidenceId": "E17"
      },
      {
        "band": "Moderate",
        "pixelCount": 79655,
        "areaKm2": 7.9655000000000005,
        "pct": 22.12638888888889,
        "evidenceId": "E18"
      },
      {
        "band": "High",
        "pixelCount": 119731,
        "areaKm2": 11.9731,
        "pct": 33.258611111111115,
        "evidenceId": "E19"
      },
      {
        "band": "Extreme",
        "pixelCount": 13970,
        "areaKm2": 1.397,
        "pct": 3.880555555555556,
        "evidenceId": "E20"
      }
    ]
  },
  "riskMatrix": [
    {
      "sRating": 5,
      "cRating": 1,
      "riskScore": 5,
      "riskBand": "Moderate",
      "pixelCount": 26470,
      "evidenceId": "E21"
    },
    {
      "sRating": 1,
      "cRating": 2,
      "riskScore": 2,
      "riskBand": "Low",
      "pixelCount": 40226,
      "evidenceId": "E22"
    },
    {
      "sRating": 2,
      "cRating": 2,
      "riskScore": 4,
      "riskBand": "Low",
      "pixelCount": 92621,
      "evidenceId": "E23"
    },
    {
      "sRating": 3,
      "cRating": 2,
      "riskScore": 6,
      "riskBand": "Moderate",
      "pixelCount": 501,
      "evidenceId": "E24"
    },
    {
      "sRating": 4,
      "cRating": 2,
      "riskScore": 8,
      "riskBand": "Moderate",
      "pixelCount": 4,
      "evidenceId": "E25"
    },
    {
      "sRating": 5,
      "cRating": 2,
      "riskScore": 10,
      "riskBand": "High",
      "pixelCount": 36883,
      "evidenceId": "E26"
    },
    {
      "sRating": 1,
      "cRating": 3,
      "riskScore": 3,
      "riskBand": "Low",
      "pixelCount": 13616,
      "evidenceId": "E27"
    },
    {
      "sRating": 2,
      "cRating": 3,
      "riskScore": 6,
      "riskBand": "Moderate",
      "pixelCount": 31618,
      "evidenceId": "E28"
    },
    {
      "sRating": 3,
      "cRating": 3,
      "riskScore": 9,
      "riskBand": "Moderate",
      "pixelCount": 3549,
      "evidenceId": "E29"
    },
    {
      "sRating": 5,
      "cRating": 3,
      "riskScore": 15,
      "riskBand": "High",
      "pixelCount": 40001,
      "evidenceId": "E30"
    },
    {
      "sRating": 1,
      "cRating": 4,
      "riskScore": 4,
      "riskBand": "Low",
      "pixelCount": 181,
      "evidenceId": "E31"
    },
    {
      "sRating": 2,
      "cRating": 4,
      "riskScore": 8,
      "riskBand": "Moderate",
      "pixelCount": 486,
      "evidenceId": "E32"
    },
    {
      "sRating": 3,
      "cRating": 4,
      "riskScore": 12,
      "riskBand": "High",
      "pixelCount": 133,
      "evidenceId": "E33"
    },
    {
      "sRating": 5,
      "cRating": 4,
      "riskScore": 20,
      "riskBand": "Extreme",
      "pixelCount": 1941,
      "evidenceId": "E34"
    },
    {
      "sRating": 1,
      "cRating": 5,
      "riskScore": 5,
      "riskBand": "Moderate",
      "pixelCount": 17027,
      "evidenceId": "E35"
    },
    {
      "sRating": 2,
      "cRating": 5,
      "riskScore": 10,
      "riskBand": "High",
      "pixelCount": 42656,
      "evidenceId": "E36"
    },
    {
      "sRating": 3,
      "cRating": 5,
      "riskScore": 15,
      "riskBand": "High",
      "pixelCount": 58,
      "evidenceId": "E37"
    },
    {
      "sRating": 5,
      "cRating": 5,
      "riskScore": 25,
      "riskBand": "Extreme",
      "pixelCount": 12029,
      "evidenceId": "E38"
    }
  ],
  "hotspots": [
    {
      "featureId": "hs-001",
      "rank": 1,
      "latitude": 49.21893530153788,
      "longitude": -122.55986021702277,
      "sRating": 5,
      "cRating": 5,
      "riskScore": 25,
      "riskBand": "Extreme",
      "evidenceId": "E39"
    },
    {
      "featureId": "hs-002",
      "rank": 2,
      "latitude": 49.21709138248992,
      "longitude": -122.59136482703713,
      "sRating": 5,
      "cRating": 5,
      "riskScore": 25,
      "riskBand": "Extreme",
      "evidenceId": "E40"
    },
    {
      "featureId": "hs-003",
      "rank": 3,
      "latitude": 49.22174873171305,
      "longitude": -122.57561419699215,
      "sRating": 5,
      "cRating": 5,
      "riskScore": 25,
      "riskBand": "Extreme",
      "evidenceId": "E41"
    },
    {
      "featureId": "hs-004",
      "rank": 4,
      "latitude": 49.222745061066796,
      "longitude": -122.58076686046323,
      "sRating": 5,
      "cRating": 5,
      "riskScore": 25,
      "riskBand": "Extreme",
      "evidenceId": "E42"
    },
    {
      "featureId": "hs-005",
      "rank": 5,
      "latitude": 49.21902886868335,
      "longitude": -122.56504712597642,
      "sRating": 5,
      "cRating": 5,
      "riskScore": 25,
      "riskBand": "Extreme",
      "evidenceId": "E43"
    },
    {
      "featureId": "hs-006",
      "rank": 6,
      "latitude": 49.20401090608993,
      "longitude": -122.57306797246811,
      "sRating": 5,
      "cRating": 5,
      "riskScore": 25,
      "riskBand": "Extreme",
      "evidenceId": "E44"
    },
    {
      "featureId": "hs-007",
      "rank": 7,
      "latitude": 49.22486883081058,
      "longitude": -122.58376017929585,
      "sRating": 5,
      "cRating": 5,
      "riskScore": 25,
      "riskBand": "Extreme",
      "evidenceId": "E45"
    },
    {
      "featureId": "hs-008",
      "rank": 8,
      "latitude": 49.20429997738501,
      "longitude": -122.56784153656146,
      "sRating": 5,
      "cRating": 5,
      "riskScore": 25,
      "riskBand": "Extreme",
      "evidenceId": "E46"
    },
    {
      "featureId": "hs-009",
      "rank": 9,
      "latitude": 49.211501460459665,
      "longitude": -122.56390277049158,
      "sRating": 5,
      "cRating": 5,
      "riskScore": 25,
      "riskBand": "Extreme",
      "evidenceId": "E47"
    },
    {
      "featureId": "hs-010",
      "rank": 10,
      "latitude": 49.21135981574813,
      "longitude": -122.558140639233,
      "sRating": 5,
      "cRating": 5,